{
  "$schema": "https://json-schema.org/draft/2020-12/schema",
  "$id": "urn:banc-essai-2027:schema:question",
  "title": "Question",
  "description": "Une question logique = un item principal × un gabarit, ou, pour une question d'attribution, une mesure × le gabarit (§5, protocole 0.9 : « une mesure engendre une seule question d'attribution »), portant ses trois formulations. §2 mettait la formulation hors de la question (\"une réponse = une question × ... × une formulation\") et §5 la mettait dedans (\"chaque question existe en trois formulations\") ; le décompte du §5 (400 items × 3 = 1 200 questions) tranchait dans un troisième sens. Convention retenue : la question est logique, les 1 200 du protocole se lisent 400 questions × 3 formulations, aucun chiffre ne change. Une question ne porte AUCUNE réponse attendue : celle-ci dépend de la date de gel et vit donc dans run.tirage[].",
  "type": "object",
  "additionalProperties": false,
  "required": ["id", "gabarit", "items", "grappe_id", "formulations", "engendree_le"],

  "properties": {
    "id": {
      "type": "string",
      "pattern": "^q_[0-9a-f]{32}$",
      "description": "Dérivé de (item principal, gabarit), et de rien d'autre : l'identité doit survivre à une correction d'item, sinon \"questions communes aux deux runs\" (§8, tendance) et la reprise à 80 % (§5) sont indécidables. Pour une question d'attribution, dérivé de (mesure, gabarit) dans un espace distinct (§5, protocole 0.9 : « son identité et sa grappe sont celles de la mesure ») : il survit à la correction ou au retrait d'un item de la mesure, et ne peut coïncider avec l'identifiant d'une question d'item. La dérive de contenu est captée par formulations[].empreinte_texte, pas par l'id."
    },

    "gabarit": { "$ref": "urn:banc-essai-2027:schema:commun#/$defs/gabarit" },

    "candidat_id": {
      "$ref": "urn:banc-essai-2027:schema:commun#/$defs/identifiant_court",
      "description": "Interdit pour Q-ATT : §5 exige \"aucun nom de candidat dans les questions d'attribution, qui ne nomment que la mesure\". Conséquence à assumer côté symétrie : le test \"même nombre de questions par candidat\" ne peut pas porter sur les Q-ATT, qui ne sont attribuables à aucun candidat."
    },

    "items": {
      "type": "array",
      "minItems": 1,
      "description": "Plusieurs items de référence peuvent être pertinents pour une même question. Q-ATT (\"Quels candidats proposent [mesure] ?\") porte par construction sur tous les items vérifiés qui donnent une position sur la mesure (P et O), en attendu_dans_liste et sans item principal (protocole 0.9) ; sur une mesure fictive, elle porte l'item F en principal, qui attend \"aucun\". La liste attendue se résout au gel, sur leurs positions en vigueur (annexe B, protocole 0.6), et vit dans le tirage. Exactement un principal hors Q-ATT, au plus un pour une Q-ATT (voir allOf). Le squelette de prompt juge de l'annexe D, qui ne prend qu'un item, était donc insuffisant.",
      "items": {
        "type": "object",
        "additionalProperties": false,
        "required": ["reference", "role"],
        "properties": {
          "reference": { "$ref": "urn:banc-essai-2027:schema:commun#/$defs/reference_item" },
          "role": {
            "type": "string",
            "enum": ["principal", "attendu_dans_liste", "distracteur", "contexte"],
            "description": "principal : l'item qui définit la question et, hors Q-ATT, la grappe. attendu_dans_liste : item P ou O de la mesure d'une Q-ATT, dont la position EN VIGUEUR AU GEL décide si son candidat figure dans la liste attendue (\"pour\" : présent ; \"contre\" ou hors validité : absent) ; le rôle seul ne dit donc pas que le candidat est attendu, tirage.reponse_attendue.candidats_attendus fait foi. distracteur : item proche servant à détecter la mauvaise attribution. contexte : fourni au juge sans attente propre."
          }
        }
      }
    },

    "grappe_id": {
      "$ref": "urn:banc-essai-2027:schema:commun#/$defs/ulid",
      "description": "Identifiant de l'item principal, STOCKÉ ; pour une question d'attribution, identifiant de sa mesure (§8, protocole 0.9 : « la grappe étant l'item […], et la mesure pour une question d'attribution »). Laisser l'analyse la recalculer reviendrait à faire vivre la métrique à deux endroits. La cohérence avec les items se vérifie hors schéma (pipeline/questions/invariants.ts)."
    },

    "formulations": {
      "type": "array",
      "minItems": 3,
      "maxItems": 3,
      "description": "§5 : neutre, familière, orientée. Produites par un modèle puis relues par un annotateur qui vérifie qu'elles ne changent pas le sens.",
      "items": {
        "type": "object",
        "additionalProperties": false,
        "required": ["id", "registre", "texte", "empreinte_texte", "production", "relecture"],
        "properties": {
          "id": { "$ref": "urn:banc-essai-2027:schema:commun#/$defs/ulid" },
          "registre": { "$ref": "urn:banc-essai-2027:schema:commun#/$defs/registre" },
          "texte": { "type": "string", "minLength": 5 },
          "empreinte_texte": {
            "$ref": "urn:banc-essai-2027:schema:commun#/$defs/sha256",
            "description": "sha256 du texte émis. \"Question commune aux deux runs\" (§8) = même id ET même empreinte : une correction d'item qui change le texte casse la reprise explicitement au lieu de faire passer une mesure d'amélioration pour une mesure de notre propre correction."
          },
          "position_affirmee": {
            "$ref": "urn:banc-essai-2027:schema:commun#/$defs/position",
            "description": "Formulation orientée seulement. §5 (protocole 0.11) : « Sur un item O, la vérité de la prémisse dépend de la date : le relecteur note sur la formulation la position que sa prémisse affirme, et, à l'instant de gel, la prémisse est fausse si cette position diffère de la position en vigueur. » Exigée sur un item O ; sur un item P, elle ne peut qu'égaler sa position (prémisse vraie par construction) ; interdite sur un item A ou une question sans item principal ; sans effet sur un item F, dont la prémisse est fausse par construction. Ces règles lisent l'item : contrôlées hors schéma (pipeline/questions/invariants.ts). Remplace le booléen premisse_fausse, figé sur la question alors que sa valeur dépend de la date (constat n° 37) : la valeur résolue vit dans tirage.entrees[].premisse_fausse."
          },
          "production": {
            "type": "object",
            "description": "Ce qui a produit le texte. Décision D42 (2) de l'auteur du 2026-10-15 : la formulation neutre est écrite par le gabarit (pipeline/questions/gabarits.ts:remplirTexteNeutre), et sa production nomme la table de gabarits, jamais un modèle qui ne l'a pas écrite ; les formulations familière et orientée nomment le modèle et la version du prompt. La forme exacte dépend du registre : voir allOf."
          },
          "relecture": {
            "type": "object",
            "additionalProperties": false,
            "required": ["annotateur_id", "date", "sens_preserve"],
            "properties": {
              "annotateur_id": { "$ref": "urn:banc-essai-2027:schema:commun#/$defs/identifiant_court" },
              "date": { "$ref": "urn:banc-essai-2027:schema:commun#/$defs/instant" },
              "sens_preserve": { "type": "boolean" },
              "commentaire": { "type": "string" }
            }
          }
        },
        "allOf": [
          {
            "$comment": "§5 (protocole 0.11) : seule la formulation orientée porte une prémisse.",
            "if": { "properties": { "registre": { "const": "oriente" } }, "required": ["registre"] },
            "else": { "not": { "required": ["position_affirmee"] } }
          },
          {
            "$comment": "Décision D42 (2) : la neutre vient du gabarit, les deux autres d'un modèle. Les trois sont relues (relecture exigée plus haut, sans exception de registre).",
            "if": { "properties": { "registre": { "const": "neutre" } }, "required": ["registre"] },
            "then": { "properties": { "production": { "$ref": "#/$defs/production_gabarit" } } },
            "else": { "properties": { "production": { "$ref": "#/$defs/production_modele" } } }
          }
        ]
      },
      "allOf": [
        {
          "contains": { "properties": { "registre": { "const": "neutre" } }, "required": ["registre"] },
          "minContains": 1,
          "maxContains": 1
        },
        {
          "contains": { "properties": { "registre": { "const": "familier" } }, "required": ["registre"] },
          "minContains": 1,
          "maxContains": 1
        },
        {
          "contains": { "properties": { "registre": { "const": "oriente" } }, "required": ["registre"] },
          "minContains": 1,
          "maxContains": 1
        }
      ]
    },

    "engendree_le": { "$ref": "urn:banc-essai-2027:schema:commun#/$defs/instant" },

    "version_gabarits": {
      "type": "string",
      "minLength": 1,
      "description": "Version du fichier de gabarits utilisé (prompts/). Un gabarit modifié est un amendement (§9)."
    }
  },

  "$defs": {
    "production_gabarit": {
      "type": "object",
      "additionalProperties": false,
      "required": ["gabarits"],
      "properties": {
        "gabarits": {
          "type": "string",
          "minLength": 1,
          "description": "Version de la table de gabarits qui a écrit le texte neutre (pipeline/questions/gabarits.ts:VERSION_GABARITS, par exemple prompts/gabarits-1.0.0)."
        }
      }
    },
    "production_modele": {
      "type": "object",
      "additionalProperties": false,
      "required": ["modele", "version_prompt"],
      "properties": {
        "modele": { "type": "string", "minLength": 1 },
        "version_prompt": {
          "type": "string",
          "minLength": 1,
          "description": "Référence au fichier versionné de prompts/. Règle 6 : aucun prompt en dur."
        }
      }
    }
  },

  "allOf": [
    {
      "$comment": "§5 : les questions d'attribution ne nomment que la mesure.",
      "if": { "properties": { "gabarit": { "const": "Q-ATT" } }, "required": ["gabarit"] },
      "then": { "not": { "required": ["candidat_id"] } },
      "else": { "required": ["candidat_id"] }
    },
    {
      "$comment": "§5 (protocole 0.9) : une question d'attribution porte au plus un item principal (l'item F d'une mesure fictive), aucun sur une mesure réelle ; toute autre question en porte exactement un.",
      "if": { "properties": { "gabarit": { "const": "Q-ATT" } }, "required": ["gabarit"] },
      "then": {
        "properties": {
          "items": {
            "contains": { "type": "object", "required": ["role"], "properties": { "role": { "const": "principal" } } },
            "minContains": 0,
            "maxContains": 1
          }
        }
      },
      "else": {
        "properties": {
          "items": {
            "contains": { "type": "object", "required": ["role"], "properties": { "role": { "const": "principal" } } },
            "minContains": 1,
            "maxContains": 1
          }
        }
      }
    },
    {
      "$comment": "Annexe B : Q-ACT porte sur les dates de validité, donc sur un item O.",
      "if": { "properties": { "gabarit": { "const": "Q-ACT" } }, "required": ["gabarit"] },
      "then": { "required": ["grappe_id"] }
    }
  ]
}
